post_title,negative,neutral,positive,compound
"""Bitcoin's use of energy isn't a dirty secret - it's a clean break""",0.419,0.581,0.0,0.7356
"Bitcoin, The Perfect Option, by Greg Foss and Seb Bunney",0.291,0.709,0.0,0.5719
"I made the fastest loading live bitcoin price ticker on the App Store (&lt;300ms, completely free)",0.193,0.807,0.0,0.5563
"There are people who bought tickets for the Bitcoin conference 2022 but cannot make it. Because there are no refunds, If you’d like to purchase their ticket please visit tixel.",0.172,0.75,0.078,0.5267
"We need YOUR help at 1140,10",0.351,0.649,0.0,0.4019
Thank you Satoshi,0.556,0.444,0.0,0.3612
Biggest live demonstration of Proof of Work on Reddit,0.149,0.851,0.0,0.1027
"Daily Discussion, April 03, 2022",0.0,1.0,0.0,0.0
The largest Bitcoin Conference in history starts in 3 days!,0.0,1.0,0.0,0.0
Hyperinflation is confirmed in Germany: German food retailers to raise prices by 20-50% on Monday,0.0,1.0,0.0,0.0
"Mt.gox, the gateway exchange that brought many people into Bitcoin in the first place is back in key news",0.0,1.0,0.0,0.0
SLP364 Max Hillebrand ZKSnacks Blacklisting Coins,0.0,1.0,0.0,0.0
I'M ALL IN: Bitcoin &amp; The Exponential Age.,0.0,1.0,0.0,0.0
Astrophysicist Neil deGrasse Tyson learns about Bitcoin,0.0,1.0,0.0,0.0
Pierre Rochard on Kraken's Lightning Network Integration,0.0,1.0,0.0,0.0
What's the dominant recurring theme here?,0.0,1.0,0.0,0.0
EU draft does not include person-to-person transactions,0.0,1.0,0.0,0.0
"""Economists"" are mystified",0.0,1.0,0.0,0.0
Governments have stopped any development of money beyond its primitive form,0.0,0.84,0.16,-0.2263
Senators Lummis &amp; Gillibrand of New York Are Working on Bipartisan Legislation Simplifying Tax Rules For Bitcoin | Potentially No Capital Gains Under a Certain Threshold | POLITCO,0.067,0.798,0.135,-0.2815
DOOM VORTEX &amp; BITCOIN,0.0,0.466,0.534,-0.5319
What if Apple Pay is about to let all of their users scan and pay to lightning invoices by integrating Strikes API.. That would change the game!,0.0,0.811,0.189,-0.5562
WARNING TREZOR USERS: The email from noreply@trezor.us is FAKE. Do not click the link!,0.0,0.623,0.377,-0.8052
